{
  "$id": "urn:ratatoskr:contracts:events:v1:ConflictRaised",
  "$schema": "https://json-schema.org/draft/2020-12/schema",
  "title": "ConflictRaised",
  "description": "Payload of `notes.conflict.raised.v1` (contract `notes/conflict.v1`): a write reached the head\nof its file's queue and its base revision was not the current revision, or a `create` met a\nlive file with the same case-folded path. The current revision did not change.\n\nA fact. The enclosing envelope carries the owner as `tenant_id` (`user:<id>`) and the\naggregate `notes_conflict:<conflict_id>`. The payload names the three sides by their hashes and\nnever carries file content; a client reads the sides and the proposal through\n`GET /v1/notes/conflicts/{conflict_id}`. Every member it does not declare is refused.\n\n`Deserialize` is hand-written because the rules are cross-field: a `merge_proposal` is present\nonly for `text/markdown` and `text/plain`, and only when all three hashes are present. It\nparses a private mirror struct and then calls [`ConflictRaised::validate`].",
  "type": "object",
  "properties": {
    "base_hash": {
      "description": "The lowercase hex SHA-256 of the revision that the writer read. Absent for `create`,\nwhich names no base.",
      "anyOf": [
        {
          "$ref": "#/$defs/DigestHex"
        },
        {
          "type": "null"
        }
      ]
    },
    "conflict_id": {
      "description": "The conflict. It stays open until a `resolve_conflict` write names it.",
      "$ref": "#/$defs/NotesConflictId"
    },
    "connection_id": {
      "description": "The connection whose vault holds the file.",
      "$ref": "#/$defs/NotesConnectionId"
    },
    "current_hash": {
      "description": "The lowercase hex SHA-256 of the current revision when the conflict was raised. Absent\nwhen no live file holds the path.",
      "anyOf": [
        {
          "$ref": "#/$defs/DigestHex"
        },
        {
          "type": "null"
        }
      ]
    },
    "media_type": {
      "description": "The media type of the file at `path`.",
      "$ref": "#/$defs/MediaType"
    },
    "merge_proposal": {
      "description": "The three-way merge proposal. Present only for `text/markdown` and `text/plain` when the\nbase revision is still stored, and so only when all three hashes are present.",
      "anyOf": [
        {
          "$ref": "#/$defs/MergeProposal"
        },
        {
          "type": "null"
        }
      ]
    },
    "operation_id": {
      "description": "The Platform operation of kind `notes.file.write` that ended in this conflict.",
      "$ref": "#/$defs/OperationId"
    },
    "origin": {
      "description": "Who asked for the write, repeated from the write: `platform` or `site:<site id>`.",
      "$ref": "#/$defs/WriteOrigin"
    },
    "path": {
      "description": "The path that the write named, relative to the vault root, in NFC.",
      "$ref": "#/$defs/VaultPath"
    },
    "writer_hash": {
      "description": "The lowercase hex SHA-256 of the content that the writer sent. Absent for `rename`, `move`\nand `delete`, which carry no content.",
      "anyOf": [
        {
          "$ref": "#/$defs/DigestHex"
        },
        {
          "type": "null"
        }
      ]
    }
  },
  "additionalProperties": false,
  "required": [
    "conflict_id",
    "connection_id",
    "media_type",
    "operation_id",
    "origin",
    "path"
  ],
  "x-ratatoskr-provenance": {
    "canonical_source": "ratatoskr_notes_contracts::ConflictRaised",
    "contract_id": "notes.conflict_raised",
    "contract_major_version": 1,
    "generated": "DO NOT EDIT — generated by contractsc from the canonical Rust source. Change the Rust type and run `cargo contracts generate`.",
    "generator": "contractsc",
    "generator_version": "0.1.0",
    "schemars_version": "1.2.2",
    "source_digest": "sha256:1f1dfa8d99d1a25fe9be911838655518a22dd33ed234cf9eef08c8554100960c",
    "validation_note": "This schema is a LOWER BOUND on validity. Cross-field invariants and canonical-form rules are enforced by the canonical Rust type; see fixtures/invalid-expectations.toml for which layer rejects what."
  },
  "$defs": {
    "DigestHex": {
      "title": "DigestHex",
      "description": "Lowercase hexadecimal bytes of a content digest.",
      "type": "string",
      "examples": [
        "0000000000000000000000000000000000000000000000000000000000000000"
      ],
      "maxLength": 64,
      "pattern": "^[0-9a-f]{64}$"
    },
    "MediaType": {
      "title": "MediaType",
      "description": "Internet media type of stored bytes, without parameters.",
      "type": "string",
      "examples": [
        "text/html",
        "application/pdf"
      ],
      "maxLength": 255,
      "pattern": "^[a-z0-9][a-z0-9!#$&^_.+-]{0,126}/[a-z0-9][a-z0-9!#$&^_.+-]{0,126}$"
    },
    "MergeProposal": {
      "description": "A line-based three-way merge of the base, the current revision and the writer's content.\n\nA proposal only: `ratatoskr-notes` never applies it on its own. The owner reads the merged\nbytes through `GET /v1/notes/conflicts/{conflict_id}` and accepts them with the resolution\nchoice `accept_merge`.",
      "type": "object",
      "properties": {
        "has_overlapping_hunks": {
          "description": "`true` when at least one hunk changed on both sides, so the merged bytes need the owner's\nreview; `false` when the two sides changed different lines.",
          "type": "boolean"
        },
        "merged_hash": {
          "description": "The lowercase hex SHA-256 of the merged bytes.",
          "$ref": "#/$defs/DigestHex"
        }
      },
      "additionalProperties": false,
      "required": [
        "has_overlapping_hunks",
        "merged_hash"
      ]
    },
    "NotesConflictId": {
      "title": "NotesConflictId",
      "description": "Identity of one conflict of a connected vault. Bare canonical lowercase hyphenated UUID; not namespaced.",
      "type": "string",
      "format": "uuid",
      "examples": [
        "018f0000-0000-7000-8000-000000000001"
      ],
      "pattern": "^[0-9a-f]{8}-[0-9a-f]{4}-[0-9a-f]{4}-[0-9a-f]{4}-[0-9a-f]{12}$"
    },
    "NotesConnectionId": {
      "title": "NotesConnectionId",
      "description": "Identity of one vault connection of ratatoskr-notes. Bare canonical lowercase hyphenated UUID; not namespaced.",
      "type": "string",
      "format": "uuid",
      "examples": [
        "018f0000-0000-7000-8000-000000000001"
      ],
      "pattern": "^[0-9a-f]{8}-[0-9a-f]{4}-[0-9a-f]{4}-[0-9a-f]{4}-[0-9a-f]{12}$"
    },
    "OperationId": {
      "title": "OperationId",
      "description": "Identity of one long-running operation, stable for its whole lifecycle. Bare canonical lowercase hyphenated UUID; not namespaced.",
      "type": "string",
      "format": "uuid",
      "examples": [
        "018f0000-0000-7000-8000-000000000001"
      ],
      "pattern": "^[0-9a-f]{8}-[0-9a-f]{4}-[0-9a-f]{4}-[0-9a-f]{4}-[0-9a-f]{12}$"
    },
    "VaultPath": {
      "title": "VaultPath",
      "description": "A file path relative to the vault root, segments separated by `/`.\n\nNot empty, at most 1024 UTF-8 bytes, no leading or trailing `/`, no empty, `.` or `..`\nsegment, no backslash and no C0 or DEL control character, so a path can never name a file\noutside the vault.\n\nThe path is in Unicode NFC. This contract does not check NFC: the producer normalises\nevery path before it publishes one, and a consumer may rely on it.",
      "type": "string",
      "examples": [
        "Projects/Plan.md",
        "Daily/2026-10-13.md"
      ],
      "maxLength": 1024,
      "pattern": "^(?:[^./\\\\\\x00-\\x1f\\x7f]|\\.[^./\\\\\\x00-\\x1f\\x7f]|\\.\\.[^/\\\\\\x00-\\x1f\\x7f])[^/\\\\\\x00-\\x1f\\x7f]*(?:/(?:[^./\\\\\\x00-\\x1f\\x7f]|\\.[^./\\\\\\x00-\\x1f\\x7f]|\\.\\.[^/\\\\\\x00-\\x1f\\x7f])[^/\\\\\\x00-\\x1f\\x7f]*)*$"
    },
    "WriteOrigin": {
      "title": "WriteOrigin",
      "description": "Who asked for a write: `platform` for the Ratatoskr API, or `site:<site id>` for a site in\nowner mode.\n\nA site id has 3 to 40 lower-case ASCII letters, digits and `-`. Every other value is\nrefused. `ratatoskr-notes` records the origin with the write and repeats it in a conflict\nthat the write raises.",
      "type": "string",
      "examples": [
        "platform",
        "site:docs"
      ],
      "maxLength": 45,
      "pattern": "^(?:platform|site:[a-z0-9-]{3,40})$"
    }
  }
}
