{
  "conflict_id": "018f0000-0000-7000-8000-000000000e01",
  "operation_id": "018f0000-0000-7000-8000-000000000d01",
  "connection_id": "018f0000-0000-7000-8000-000000000b01",
  "path": "Notes/Todo.txt",
  "origin": "platform",
  "media_type": "text/plain",
  "base_hash": "0a1b2c3d4e5f60710a1b2c3d4e5f60710a1b2c3d4e5f60710a1b2c3d4e5f6071",
  "current_hash": "3c4d5e6f708192a33c4d5e6f708192a33c4d5e6f708192a33c4d5e6f708192a3",
  "writer_hash": "1f2e3d4c5b6a70811f2e3d4c5b6a70811f2e3d4c5b6a70811f2e3d4c5b6a7081",
  "merge_proposal": {
    "merged_hash": "4d5e6f708192a3b44d5e6f708192a3b44d5e6f708192a3b44d5e6f708192a3b4",
    "has_overlapping_hunks": true
  }
}
